{
  "_comment": "A second brand off the same formula — purple/green palette, no logo file (falls back to the text lockup). Proof that a whole new show is just a new config.",

  "brand": {
    "name": "Midnight Arcade",
    "short": "MDA",
    "lineOne": "Midnight",
    "lineTwo": "Arcade",
    "kicker": "★ Now Playing ★",
    "tagline": "Step up. Strike a pose. Press start.",
    "followLabel": "Join the players",
    "hashtag": "#MidnightArcade",
    "galleryCta": "Add to the Arcade",
    "galleryDone": "Added ✓"
  },

  "colors": {
    "bg": "#0b0713",
    "primary": "#8b5cf6",
    "primaryBright": "#a78bfa",
    "secondary": "#34e0a1",
    "accent": "#ffd24a",
    "ink": "#f5f3fb",
    "dim": "#9b93b5"
  },

  "socials": {
    "instagram": "https://instagram.com/midnightarcade",
    "facebook": "https://facebook.com/midnightarcade",
    "tiktok": "https://tiktok.com/@midnightarcade",
    "igHandle": "midnightarcade"
  },

  "web": {
    "storagePrefix": "mda",
    "netlifyName": "midnight-arcade",
    "primaryDomain": "booth.midnightarcade.com",
    "rootDomain": "midnightarcade.com"
  }
}
